username;date;retweets;favorites;text;geo;mentions;hashtags;id;permalink
dfrtraffic;2018-11-24 18:58;0;0;"Motor Vehicle Accident | L B J TEXPRESS WB / COIT RD | https:// goo.gl/VwgBeW | EN22 | 220044 | 18:58 | A";;;;"1066496195462234112";https://twitter.com/dfrtraffic/status/1066496195462234112
dfrtraffic;2018-11-24 18:58;0;0;"Motor Vehicle Accident | 9500 SOPHORA DR | https:// goo.gl/RaVYm9 | DU RE272 | 120468 | 18:58 | A";;;;"1066496191003734016";https://twitter.com/dfrtraffic/status/1066496191003734016
TotalTrafficDFW;2018-11-24 18:56;0;0;"Accident , right lane blocked in #Arlington on 360 SB at Mayfield Rd, stop and go traffic back to Pioneer Pkwy, delay of 3 mins #DFWTraffic";;;#Arlington #DFWTraffic;"1066495727671681024";https://twitter.com/TotalTrafficDFW/status/1066495727671681024
TotalTrafficDFW;2018-11-24 18:55;0;0;"Accident . two right lanes blocked in #Dallas on 35E NB at Marsalis Ave, stop and go traffic back to Illinois Ave, delay of 6 mins";;;#Dallas;"1066495465007575040";https://twitter.com/TotalTrafficDFW/status/1066495465007575040
dpdcentral;2018-11-24 18:40;0;0;"Central Division responding to '7X - Major Accident ' at Ross Ave / N Henderson Ave | Beat 144 | https:// goo.gl/7AwpoG | 18:36";;;;"1066491662593998848";https://twitter.com/dpdcentral/status/1066491662593998848
bonjelbis;2018-11-24 18:37;0;0;"My @lyft driver can’t drive well almost got into two accidents . #jeeze";;@lyft;#jeeze;"1066491087085289472";https://twitter.com/bonjelbis/status/1066491087085289472
TotalTrafficDFW;2018-11-24 18:35;0;0;"Accident . two right lanes blocked in #Irving on 183 EB at Regal Row, stop and go traffic back to Spur 482, delay of 4 mins #DFWTraffic";;;#Irving #DFWTraffic;"1066490633689407488";https://twitter.com/TotalTrafficDFW/status/1066490633689407488
TotalTrafficDFW;2018-11-24 18:29;0;0;"Accident , right lane blocked in #Irving on 183 EB at Regal Row, stop and go traffic back to Spur 482, delay of 4 mins #DFWTraffic";;;#Irving #DFWTraffic;"1066489067246891009";https://twitter.com/TotalTrafficDFW/status/1066489067246891009
dfrtraffic;2018-11-24 18:28;0;0;"Motor Vehicle Accident | L B J RAMP WB / MARVIN D LOVE FWY SB | https:// goo.gl/LAZ7Cn | EN40 | 400378 | 18:28 | A";;;;"1066488649628274688";https://twitter.com/dfrtraffic/status/1066488649628274688
dfrtraffic;2018-11-24 18:28;0;0;"Motor Vehicle Accident | ROSS AVE / N HENDERSON AVE | https:// goo.gl/kll8Jz | EN08 | 080017 | 18:28 | A";;;;"1066488645605978112";https://twitter.com/dfrtraffic/status/1066488645605978112
dpdincidents;2018-11-24 18:22;0;0;"North Central Supervisor responding to '7X - Major Accident ' at L B J Fwy Wb / Preston Rd | Beat 641 | https:// goo.gl/INm4FB | 18:03";;;;"1066487138332565505";https://twitter.com/dpdincidents/status/1066487138332565505
dfrtraffic;2018-11-24 18:18;1;1;"Motor Vehicle Accident | CLIFFBROOK DR / MEADOWCREEK DR | https:// goo.gl/HH6tm2 | EN56 | 560024 | 18:18 | A";;;;"1066486131607269376";https://twitter.com/dfrtraffic/status/1066486131607269376
dfrtraffic;2018-11-24 18:18;0;0;"Motor Vehicle Accident | JOHN W CARPENTER FWY SB / W MOCKINGBIRD LN | https:// goo.gl/e9SWdT | EN42 | 470049 | 18:18 | A";;;;"1066486126628679680";https://twitter.com/dfrtraffic/status/1066486126628679680
TotalTrafficDFW;2018-11-24 18:10;0;0;"Accident . two right lanes blocked in #Mesquite on 635 LBJ Fwy NB at Scyene Rd, stop and go traffic back to Lk June Rd, delay of 7 mins";;;#Mesquite;"1066484212457443328";https://twitter.com/TotalTrafficDFW/status/1066484212457443328
TotalTrafficDFW;2018-11-24 18:08;0;0;"Accident has the two right lanes getting by. in #Dallas on 635 LBJ Fwy WB at Preston Rd, stopped traffic back to 75 Central Expwy";;;#Dallas;"1066483821288308736";https://twitter.com/TotalTrafficDFW/status/1066483821288308736
TotalTrafficDFW;2018-11-24 18:03;0;0;"Closed due to accident in #Dallas on 635 LBJ Fwy WB between Hillcrest Rd and Preston Rd, stopped traffic back to 75 Central Expwy";;;#Dallas;"1066482387918487552";https://twitter.com/TotalTrafficDFW/status/1066482387918487552
TotalTrafficDFW;2018-11-24 18:02;0;0;"Closed due to accident in #Dallas on 635 LBJ Fwy WB between Hillcrest Rd and Preston Rd #DFWTraffic http:// bit.ly/14TuwzZ";;;#Dallas #DFWTraffic;"1066482254866726912";https://twitter.com/TotalTrafficDFW/status/1066482254866726912
TotalTrafficDFW;2018-11-24 18:00;0;0;"Accident . two right lanes blocked in #Mesquite on 635 LBJ Fwy NB at Scyene Rd, stop and go traffic back to Bruton Rd, delay of 4 mins";;;#Mesquite;"1066481590501629952";https://twitter.com/TotalTrafficDFW/status/1066481590501629952
dfrtraffic;2018-11-24 17:58;0;0;"Motor Vehicle Accident | L B J Fwy Wb / Preston Rd | https:// goo.gl/TV3zfC | EN56 | 200036 | 17:58 | A";;;;"1066481092151017472";https://twitter.com/dfrtraffic/status/1066481092151017472
dfrtraffic;2018-11-24 17:48;0;0;"Motor Vehicle Accident | 5900 L B J FWY WB | https:// goo.gl/iicdDm | EN22 | 200036 | 17:48 | A";;;;"1066478576256507904";https://twitter.com/dfrtraffic/status/1066478576256507904
dfrtraffic;2018-11-24 17:18;0;0;"Motor Vehicle Accident | GARLAND RD / N BUCKNER BLVD | https:// goo.gl/MSVSNI | EN31 | 310037 | 17:18 | A";;;;"1066471029638221824";https://twitter.com/dfrtraffic/status/1066471029638221824
dfrtraffic;2018-11-24 17:08;1;1;"Motor Vehicle Accident | 52ND ST / CORRIGAN AVE | https:// goo.gl/Y5pGCr | EN25 | 250369 | 17:08 | A";;;;"1066468511785005056";https://twitter.com/dfrtraffic/status/1066468511785005056
kisosuiende;2018-11-24 16:59;0;0;"Le rôle de la galectine-3 dans les accidents vasculaires cérébraux et les maladies du système cérébrovasculaire: Les taux de galectine-3 sont plus élevés chez les animaux dans les 60 à 96 heures suivant une ischémie cérébrale focale [16,17] bien que… http:// dlvr.it/Qs2F1y";;;;"1066466373717549057";https://twitter.com/kisosuiende/status/1066466373717549057
dpdcentral;2018-11-24 16:52;0;0;"Central Division responding to '7X - Major Accident ' at 1800 blk Corsicana St | Beat 135 | https:// goo.gl/B016EJ | 16:49";;;;"1066464488289759232";https://twitter.com/dpdcentral/status/1066464488289759232
dpdincidents;2018-11-24 16:52;0;0;"Central Supervisor responding to '7X - Major Accident ' at 1800 blk Corsicana St | Beat 135 | https:// goo.gl/B016EJ | 16:49";;;;"1066464485773213696";https://twitter.com/dpdincidents/status/1066464485773213696
TotalTrafficDFW;2018-11-24 16:41;0;2;"Accident , right lane blocked in #Dallas on 35E SB at Regal Row, stop and go traffic back to NW Hwy, delay of 6 mins #DFWTraffic";;;#Dallas #DFWTraffic;"1066461924475510784";https://twitter.com/TotalTrafficDFW/status/1066461924475510784
TotalTrafficDFW;2018-11-24 16:41;0;0;"Accident , right lane blocked in #Dallas on 35E SB at Regal Row #DFWTraffic http:// bit.ly/14TuwzZ";;;#Dallas #DFWTraffic;"1066461792577167360";https://twitter.com/TotalTrafficDFW/status/1066461792577167360
Sainttea12;2018-11-24 16:38;0;0;"Silly can also be shooting your foot by accident a 2A rally, Joseph.";;;;"1066461050516713474";https://twitter.com/Sainttea12/status/1066461050516713474
armstronglanet3;2018-11-24 16:36;0;0;"I liked a @YouTube video http:// youtu.be/TBDv6ffe6Io?a Ruthie's Car Accident | Inspirational | Christian Motivational Speech";;@YouTube;;"1066460478954708992";https://twitter.com/armstronglanet3/status/1066460478954708992
TotalTrafficDFW;2018-11-24 16:29;0;0;"Accident in #CedarHill on Hwy 67 SB at Joe Wilson Rd, stop and go traffic back to Main St, delay of 4 mins #DFWTraffic http:// bit.ly/14TuwzZ";;;#CedarHill #DFWTraffic;"1066458794199314434";https://twitter.com/TotalTrafficDFW/status/1066458794199314434
dfrtraffic;2018-11-24 16:28;0;0;"Motor Vehicle Accident | 1000 S R L THORNTON FWY NB | https:// goo.gl/OnK4qS | EN33 | 330072 | 16:28 | A";;;;"1066458444905869312";https://twitter.com/dfrtraffic/status/1066458444905869312
dpdincidents;2018-11-24 16:26;0;0;"Northeast Supervisor responding to '7X - Major Accident ' at N Central Serv Nb / Walnut Hill Ln | Beat 211 | https:// goo.gl/6Byy1R | 16:22";;;;"1066457940935139329";https://twitter.com/dpdincidents/status/1066457940935139329
dfrtraffic;2018-11-24 16:18;1;1;"Motor Vehicle Accident | N CENTRAL SERV NB / WALNUT HILL LN | https:// goo.gl/pUrS6z | EN37 | 370080 | 16:18 | A";;;;"1066455927610458113";https://twitter.com/dfrtraffic/status/1066455927610458113
Gessel19_;2018-11-24 16:08;0;0;"I just got in a car accident nd my dad really wanna be calling me lazy for not going to a party";;;;"1066453632726548481";https://twitter.com/Gessel19_/status/1066453632726548481
TotalTrafficDFW;2018-11-24 15:36;0;0;"Accident is affecting the entrance ramp. in #Dallas on 30 WB at St Francis Ave #DFWTraffic http:// bit.ly/14TuwzZ";;;#Dallas #DFWTraffic;"1066445476457787397";https://twitter.com/TotalTrafficDFW/status/1066445476457787397
TotalTrafficDFW;2018-11-24 15:04;1;1;"Accident , right lane blocked in #Irving on 114 EB at Spur 482, stop and go traffic back to Lp 12 Walton Walker, delay of 1 min #DFWTraffic";;;#Irving #DFWTraffic;"1066437344373424130";https://twitter.com/TotalTrafficDFW/status/1066437344373424130
TotalTrafficDFW;2018-11-24 15:03;0;0;"Accident is affecting the exit ramp. in #Irving on 114 EB at Spur 482 #DFWTraffic http:// bit.ly/14TuwzZ";;;#Irving #DFWTraffic;"1066437211246215168";https://twitter.com/TotalTrafficDFW/status/1066437211246215168
TotalTrafficDFW;2018-11-24 15:03;0;0;"Accident , right lane blocked in #Irving on 114 EB at Spur 482 #DFWTraffic http:// bit.ly/14TuwzZ";;;#Irving #DFWTraffic;"1066437079725424641";https://twitter.com/TotalTrafficDFW/status/1066437079725424641
TotalTrafficDFW;2018-11-24 14:41;0;0;"Accident , left lane blocked in #GrandPrairie on 30 EB at Great SW Pkwy, stop and go traffic back to 360, delay of 3 mins #DFWTraffic";;;#GrandPrairie #DFWTraffic;"1066431661309640704";https://twitter.com/TotalTrafficDFW/status/1066431661309640704
TotalTrafficDFW;2018-11-24 14:28;0;0;"Accident , right lane blocked in #Dallas on 30 WB at Ferguson Rd, stop and go traffic back to Jim Miller Rd, delay of 4 mins #DFWTraffic";;;#Dallas #DFWTraffic;"1066428350867128320";https://twitter.com/TotalTrafficDFW/status/1066428350867128320
dfrtraffic;2018-11-24 14:28;0;0;"Motor Vehicle Accident | ALDERSON ST / E MOCKINGBIRD LN | https:// goo.gl/Y7fSZe | EN55 | 550017 | 14:28 | A";;;;"1066428247078891525";https://twitter.com/dfrtraffic/status/1066428247078891525
TotalTrafficDFW;2018-11-24 14:27;0;0;"Accident is affecting the entrance ramp. in #Dallas on 30 WB at Ferguson Rd #DFWTraffic http:// bit.ly/14TuwzZ";;;#Dallas #DFWTraffic;"1066428215399452673";https://twitter.com/TotalTrafficDFW/status/1066428215399452673
TotalTrafficDFW;2018-11-24 14:22;0;0;"Accident , right lane blocked in #Dallas on 30 WB at Ferguson Rd #DFWTraffic http:// bit.ly/14TuwzZ";;;#Dallas #DFWTraffic;"1066426902871752705";https://twitter.com/TotalTrafficDFW/status/1066426902871752705
TheOnlyBrandon_;2018-11-24 14:22;0;4;"First time working out since the accident and I’m loving life again";;;;"1066426842721251334";https://twitter.com/TheOnlyBrandon_/status/1066426842721251334
kisosuiende;2018-11-24 14:21;0;0;"Accidents de la route somnolents – cabinet d’avocat d’Ivan m Diamond diffuse une lésion cérébrale anoxique diffuse: Que ce soit parce qu’ils ne dormaient pas suffisamment la nuit précédente, qu’ils prenaient des médicaments contre les allergies ou qu’ils… http:// dlvr.it/Qs1vny";;;;"1066426613951160320";https://twitter.com/kisosuiende/status/1066426613951160320
dfrtraffic;2018-11-24 14:18;0;0;"Motor Vehicle Accident | E R L THORNTON FWY WB / FERGUSON RD | https:// goo.gl/enOGA7 | EN32 | 190038 | 14:18 | A";;;;"1066425728395206656";https://twitter.com/dfrtraffic/status/1066425728395206656
dfrtraffic;2018-11-24 14:08;0;0;"Motor Vehicle Accident | N Akard St/woodall Rodgers Fwy Wb | https:// goo.gl/xCcUiS | EN18 | 180018 | 14:08 | A";;;;"1066423214639734784";https://twitter.com/dfrtraffic/status/1066423214639734784
dfrtraffic;2018-11-24 14:08;0;0;"Motor Vehicle Accident | DALLAS FT WORTH TPKE EB / S STEMMONS FWY SB | https:// goo.gl/zZCgBT | EN45 | 180002 | 14:08 | A";;;;"1066423210915196929";https://twitter.com/dfrtraffic/status/1066423210915196929
BrandonMcKee_;2018-11-24 13:44;1;2;"You don’t do sexual shit on accident";;;;"1066417345659310081";https://twitter.com/BrandonMcKee_/status/1066417345659310081
TotalTrafficDFW;2018-11-24 13:42;0;0;"Accident . two right lanes blocked in #Dallas on Dallas N Tollway SB at Oak Lawn Ave #DFWTraffic http:// bit.ly/14TuwzZ";;;#Dallas #DFWTraffic;"1066416832234627072";https://twitter.com/TotalTrafficDFW/status/1066416832234627072
BjwalkinRIVERS;2018-11-24 13:28;0;0;"That’s the goal. Just gotta find the woman I’m gonna make my wife first. I can’t just be going and being reckless with a bird by accident pic.twitter.com/CZKiFPb9tJ";;;;"1066413307366686720";https://twitter.com/BjwalkinRIVERS/status/1066413307366686720
RojasCicsy;2018-11-24 13:28;1;4;"If a girl bled through her bottoms in public, why is it perceived as “nasty”? Why wouldn’t it be waived off the same way food stains are. Accidents happen.";;;;"1066413280384692224";https://twitter.com/RojasCicsy/status/1066413280384692224
dfrtraffic;2018-11-24 13:28;0;0;"Motor Vehicle Accident | S POLK ST / W RED BIRD LN | https:// goo.gl/VTkYZq | EN49 | 490016 | 13:28 | A";;;;"1066413145130848256";https://twitter.com/dfrtraffic/status/1066413145130848256
dfrtraffic;2018-11-24 13:18;0;0;"Motor Vehicle Accident | DALLAS NORTH TOLLWAY SB / WYCLIFF AVE | https:// goo.gl/uaqZmy | EN01 | 110024 | 13:18 | A";;;;"1066410626543583232";https://twitter.com/dfrtraffic/status/1066410626543583232
dfrtraffic;2018-11-24 12:38;0;0;"Motor Vehicle Accident | 4500 HARTFORD ST | https:// goo.gl/U5ah8Y | EN11 | 110031 | 12:38 | A";;;;"1066400560708874240";https://twitter.com/dfrtraffic/status/1066400560708874240
JoGreene1951;2018-11-24 12:19;0;1;"100,000 worth of term life on your bro with you as the beneficiary. If he doesn't end up dead by accident or through something else it will be a miracle.";;;;"1066395841827610624";https://twitter.com/JoGreene1951/status/1066395841827610624
TRIAccidents;2018-11-24 12:01;1;1;"Much like other areas of the crash reconstruction industry, the analysis of crash events in the past were antiquated and in need for the right technology to come to its rescue. 3D scanning technology has brought crash reconstruction into the 21st Century! https://www. triplerinvestigations.com/blog/3dscanning pic.twitter.com/3fhybCVOCw";;;;"1066391397748695040";https://twitter.com/TRIAccidents/status/1066391397748695040
coachdebrah;2018-11-24 11:50;0;0;"#Accidents happen, but there are also so many precautions you can take to help prevent a #fire from occurring in your #home . http:// ow.ly/HiFv30mILFY #debrahmathisinsurance";;;#Accidents #fire #home #debrahmathisinsurance;"1066388510754725889";https://twitter.com/coachdebrah/status/1066388510754725889
slimjimeme;2018-11-24 11:25;0;2;"I tasted duck on accident thinking it’s turkey and i damn near died";;;;"1066382258007957504";https://twitter.com/slimjimeme/status/1066382258007957504
dfrtraffic;2018-11-24 10:58;0;0;"Motor Vehicle Accident | MILITARY PKWY / DOLPHIN RD | https:// goo.gl/0iZVu7 | EN44 | 190005 | 10:58 | A";;;;"1066375394754887680";https://twitter.com/dfrtraffic/status/1066375394754887680
dfrtraffic;2018-11-24 10:48;0;0;"Motor Vehicle Accident | Walnut St / Abrams Rd | https:// goo.gl/VnO9pn | EN29 | 290036 | 10:48 | A";;;;"1066372881033027584";https://twitter.com/dfrtraffic/status/1066372881033027584
Dexluger;2018-11-24 10:37;0;0;"I meant accident , but nvm lol accidentally gettin a chick pregnant is still a red flag lol. I feel you";;;;"1066370149631053824";https://twitter.com/Dexluger/status/1066370149631053824
dfrtraffic;2018-11-24 10:08;0;0;"Motor Vehicle Accident | N STEMMONS SERV NB / MEDICAL DISTRICT DR | https:// goo.gl/L74Wef | EN47 | 010031 | 10:08 | A";;;;"1066362817119285248";https://twitter.com/dfrtraffic/status/1066362817119285248
dfrtraffic;2018-11-24 10:08;0;0;"Motor Vehicle Accident | E KIEST BLVD / MICHIGAN AVE | https:// goo.gl/Dd6Xtv | EN25 | 330017 | 10:08 | A";;;;"1066362814200086528";https://twitter.com/dfrtraffic/status/1066362814200086528
Blacknallfirm;2018-11-24 10:03;0;0;"Car Accidents and Your Insurance Company: Who is the Client? http:// bit.ly/2QRd4qL";;;;"1066361660959571973";https://twitter.com/Blacknallfirm/status/1066361660959571973
dpdcentral;2018-11-24 09:50;0;0;"Central Division responding to '07 - Minor Accident ' at N St Paul St / Elm St | Beat 134 | https:// goo.gl/rYt3F5 | 09:46";;;;"1066358285110960128";https://twitter.com/dpdcentral/status/1066358285110960128
WizardTikiTiki;2018-11-24 09:33;0;0;"Baby that wasn’t an accident that was gods will";;;;"1066354170322665472";https://twitter.com/WizardTikiTiki/status/1066354170322665472
BuddhaMichael;2018-11-24 09:21;0;3;"I feel bad for people who died in car accidents but I'm not dumb enough to tell people to stop driving.";;;;"1066351109088907264";https://twitter.com/BuddhaMichael/status/1066351109088907264
ClayParrot;2018-11-24 09:11;0;0;"There are NO accidents with firearms. Only intent or negligence. There are NO accidents . @Stonekettle";;@Stonekettle;;"1066348537947058176";https://twitter.com/ClayParrot/status/1066348537947058176
dfrtraffic;2018-11-24 09:08;0;0;"Motor Vehicle Accident | 800 N BUCKNER BLVD | https:// goo.gl/2MB92F | EN31 | 310052 | 09:08 | A";;;;"1066347711534755840";https://twitter.com/dfrtraffic/status/1066347711534755840
ryan_redd;2018-11-24 09:02;0;0;"I liked a @YouTube video http:// youtu.be/cEyRBJtOINQ?a Stephen Curry SCARY Car Crash Accident !";;@YouTube;;"1066346261706608640";https://twitter.com/ryan_redd/status/1066346261706608640
TotalTrafficDFW;2018-11-24 08:51;0;0;"Accident reported on 35E NB at 30 #DFWTraffic http:// bit.ly/14TuwzZ";;;#DFWTraffic;"1066343462465871872";https://twitter.com/TotalTrafficDFW/status/1066343462465871872
OhHeyGothamGirl;2018-11-24 08:31;0;0;"Found this in my archives. This will bless someone today. Anytime i felt like this was when God was making some adjustments in the direction of my life. Nothing is an accident . @Dallas,… https://www. instagram.com/p/BqkQeXyhSXQ/ ?utm_source=ig_twitter_share&igshid=1macxw2gvh46f …";;@Dallas;;"1066338536381538304";https://twitter.com/OhHeyGothamGirl/status/1066338536381538304
dfrtraffic;2018-11-24 08:28;0;0;"Motor Vehicle Accident | N STEMMONS FWY NB / COMMERCE ST | https:// goo.gl/1K9jQS | EN04 | 180008 | 08:28 | A";;;;"1066337649898618880";https://twitter.com/dfrtraffic/status/1066337649898618880
dfrtraffic;2018-11-24 08:28;0;0;"Motor Vehicle Accident | S Zang Blvd / W 12th St | https:// goo.gl/gUh18k | EN15 | 150006 | 08:28 | A";;;;"1066337645574291457";https://twitter.com/dfrtraffic/status/1066337645574291457
kisosuiende;2018-11-24 08:21;0;0;"Roswell au Nouveau-Mexique, cabinet d’avocats spécialisé dans les blessures et l’invalidité: Lorsque vous êtes blessé dans un accident ou au travail, vous avez droit à des soins médicaux et à une indemnisation. Notre équipe juridique expérimentée protège… http:// dlvr.it/Qs0tJY";;;;"1066336018259832832";https://twitter.com/kisosuiende/status/1066336018259832832
LifeByCharsha;2018-11-24 08:20;3;5;"10 years is a long time to be with someone without becoming their wife. And I don’t agree with him marrying her knowing he on the way to jail. HOWEVER, a lot of y’all can shut tf up bc you been a secret forever. You been meeting his family and friends on accident .";;;;"1066335742505480192";https://twitter.com/LifeByCharsha/status/1066335742505480192
dfrtraffic;2018-11-24 07:38;0;0;"Motor Vehicle Accident | L B J SERV WB / GREENVILLE AVE | https:// goo.gl/86Bg0Q | EN28 | 280050 | 07:38 | A";;;;"1066325066659454976";https://twitter.com/dfrtraffic/status/1066325066659454976
dpdcentral;2018-11-24 07:32;0;0;"Central Division responding to '07 - Minor Accident ' at 3800 blk Gaston Ave | Beat 116 | https:// goo.gl/POslXF | 07:27";;;;"1066323554252185600";https://twitter.com/dpdcentral/status/1066323554252185600
NationalCI;2018-11-24 06:34;1;1;"1 Million Miles without an accident for Carlnai Pete and 5 years service in our shop for Sergion Stirk. #NCIROCKS and our people are the reason! http://www. nationalcarriers.com to learn more.";;;#NCIROCKS;"1066309032766554112";https://twitter.com/NationalCI/status/1066309032766554112
dfrtraffic;2018-11-24 06:18;0;0;"Motor Vehicle Accident | W MOCKINGBIRD LN / HALIFAX ST | https:// goo.gl/M6Hc9V | EN47 | 470030 | 06:18 | A";;;;"1066304933085888513";https://twitter.com/dfrtraffic/status/1066304933085888513
TotalTrafficDFW;2018-11-24 06:07;0;0;"Accident blocking three left lanes in #SDallas on 35E NB at Beckley Ave, stop and go traffic back to Clarendon, delay of 1 min #DFWTraffic";;;#SDallas #DFWTraffic;"1066302376544559105";https://twitter.com/TotalTrafficDFW/status/1066302376544559105
TotalTrafficDFW;2018-11-24 06:06;0;1;"Accident , right lane blocked in #Dallas on 175 WB at Lk June Rd #DFWTraffic http:// bit.ly/14TuwzZ";;;#Dallas #DFWTraffic;"1066301987506008064";https://twitter.com/TotalTrafficDFW/status/1066301987506008064
TotalTrafficDFW;2018-11-24 06:05;0;0;"Accident blocking three left lanes in #Dallas on 35E NB at S Beckley Ave #DFWTraffic http:// bit.ly/14TuwzZ";;;#Dallas #DFWTraffic;"1066301725273931777";https://twitter.com/TotalTrafficDFW/status/1066301725273931777
dfrtraffic;2018-11-24 05:58;0;0;"Motor Vehicle Accident | 6400 C F HAWN FWY WB | https:// goo.gl/C7QR5Q | EN34 | 340076 | 05:58 | A";;;;"1066299897098293248";https://twitter.com/dfrtraffic/status/1066299897098293248
dfrtraffic;2018-11-24 05:48;0;0;"Motor Vehicle Accident | S R L THORNTON FWY NB / S EWING AVE | https:// goo.gl/2mf6sl | EN14 | 150013 | 05:48 | A";;;;"1066297391723106304";https://twitter.com/dfrtraffic/status/1066297391723106304
dfrtraffic;2018-11-24 05:48;0;0;"Motor Vehicle Accident | 9500 E R L THORNTON FWY WB | https:// goo.gl/HuuY29 | EN39 | 530073 | 05:48 | A";;;;"1066297387834961922";https://twitter.com/dfrtraffic/status/1066297387834961922
dfrtraffic;2018-11-24 05:18;0;0;"Motor Vehicle Accident | 8100 Fireside Dr | https:// goo.gl/Th4zTn | EN51 | 510117 | 05:18 | A";;;;"1066289831246872579";https://twitter.com/dfrtraffic/status/1066289831246872579
HendersonAlan;2018-11-24 04:17;0;0;"Cougars marching band performs Husky fight song in rival band's absence following UW bus accident http://www. newsweek.com/cougars-marchi ng-band-performs-husky-fight-song-rival-bands-absence-1229655 …";;;;"1066274501581832192";https://twitter.com/HendersonAlan/status/1066274501581832192
dfrtraffic;2018-11-24 04:08;0;0;"Motor Vehicle Accident | L B J SERV WB / BONNIE VIEW RD | https:// goo.gl/8HfjTU | EN54 | 540422 | 04:08 | C";;;;"1066272218051563520";https://twitter.com/dfrtraffic/status/1066272218051563520
dpdcentral;2018-11-24 03:48;0;0;"Central Division responding to '7XF - Major Accident Freeway' at E R L Thornton Fwy Wb / S Lamar St | Beat 136 | https:// goo.gl/Kj5lPs | 03:43";;;;"1066267186518343682";https://twitter.com/dpdcentral/status/1066267186518343682
dfrtraffic;2018-11-24 03:48;0;0;"Motor Vehicle Accident | E R L THORNTON FWY WB / S LAMAR ST | https:// goo.gl/h9MKSq | EN03 | 180003 | 03:48 | C";;;;"1066267181694865408";https://twitter.com/dfrtraffic/status/1066267181694865408
dfrtraffic;2018-11-24 03:28;0;0;"Motor Vehicle Accident | 2400 Walnut Hill Ln | https:// goo.gl/qYtTle | EN43 | 470350 | 03:28 | C";;;;"1066262150665035776";https://twitter.com/dfrtraffic/status/1066262150665035776
dfrtraffic;2018-11-24 03:18;0;0;"Motor Vehicle Accident | N POLK ST / W DAVIS ST | https:// goo.gl/us4A8y | EN14 | 140030 | 03:18 | C";;;;"1066259631633092608";https://twitter.com/dfrtraffic/status/1066259631633092608
TotalTrafficDFW;2018-11-24 03:00;0;0;"Accident , left lane blocked in #Dallas on 30 WB at S Ervay St #DFWTraffic http:// bit.ly/14TuwzZ";;;#Dallas #DFWTraffic;"1066255105073315842";https://twitter.com/TotalTrafficDFW/status/1066255105073315842
dpdcentral;2018-11-24 02:48;0;0;"Central Division responding to '7X - Major Accident ' at Cedar Springs Rd / Carlisle St | Beat 122 | https:// goo.gl/FYMOAA | 02:44";;;;"1066252087099457536";https://twitter.com/dpdcentral/status/1066252087099457536
dfrtraffic;2018-11-24 02:48;0;0;"Motor Vehicle Accident | JELLISON BLVD / CEDAR RIDGE DR | https:// goo.gl/eF9Dfu | EN12 | 120728 | 02:48 | C";;;;"1066252085790818304";https://twitter.com/dfrtraffic/status/1066252085790818304
dfrtraffic;2018-11-24 02:38;0;0;"Motor Vehicle Accident | CEDAR SPRINGS RD / CARLISLE ST | https:// goo.gl/HfbA5O | EN11 | 110003 | 02:38 | C";;;;"1066249566020718592";https://twitter.com/dfrtraffic/status/1066249566020718592
__andrew17;2018-11-24 02:22;0;1;"Listen Kaycee I said it was an accident https:// twitter.com/kaitlyn_kait_/ status/1066245401798483969 …";;;;"1066245594514145280";https://twitter.com/__andrew17/status/1066245594514145280
dfrtraffic;2018-11-24 02:18;0;0;"Motor Vehicle Accident | 4400 BESSIE DR | https:// goo.gl/ZAgaFv | EN52 | 520111 | 02:18 | C";;;;"1066244532411330560";https://twitter.com/dfrtraffic/status/1066244532411330560
dfrtraffic;2018-11-24 02:08;0;0;"Motor Vehicle Accident | E R L THORNTON FWY WB / S ERVAY ST | https:// goo.gl/dRUuZK | EN03 | 040021 | 02:08 | C";;;;"1066242022527234048";https://twitter.com/dfrtraffic/status/1066242022527234048
dfrtraffic;2018-11-24 02:08;0;0;"Motor Vehicle Accident | E R L THORNTON FWY WB / S R L THORNTON RAMP NB | https:// goo.gl/MHlVXL | EN44 | 040022 | 02:08 | C";;;;"1066242018702020608";https://twitter.com/dfrtraffic/status/1066242018702020608
TotalTrafficDFW;2018-11-24 02:03;0;0;"Accident . two left lanes blocked in #Dallas on 30 WB at Carroll Ave #DFWTraffic http:// bit.ly/14TuwzZ";;;#Dallas #DFWTraffic;"1066240999029125120";https://twitter.com/TotalTrafficDFW/status/1066240999029125120
