username;date;retweets;favorites;text;geo;mentions;hashtags;id;permalink
TotalTrafficDFW;2018-11-26 05:35;1;0;"Accident reported in #Dallas on 35E NB after 8th St, stop and go traffic back to Marsalis Ave, delay of 2 mins #DFWTraffic";;;#Dallas #DFWTraffic;"1067019025891377152";https://twitter.com/TotalTrafficDFW/status/1067019025891377152
TotalTrafficDFW;2018-11-26 05:15;0;0;"Accident cleared in #Lancaster on 35E SB before Parkerville Rd, stop and go traffic back to Belt Line Rd, delay of 3 mins #DFWTraffic";;;#Lancaster #DFWTraffic;"1067014038226374656";https://twitter.com/TotalTrafficDFW/status/1067014038226374656
TotalTrafficDFW;2018-11-26 04:54;0;0;"Closed due to accident in #Lancaster on 35E SB before Parkerville Rd, stopped traffic back to Belt Line Rd #DFWTraffic http:// bit.ly/14TuwzZ";;;#Lancaster #DFWTraffic;"1067008775788335104";https://twitter.com/TotalTrafficDFW/status/1067008775788335104
TotalTrafficDFW;2018-11-26 04:53;0;0;"Closed due to accident in #Lancaster on 35E SB at Parkerville Rd #DFWTraffic http:// bit.ly/14TuwzZ";;;#Lancaster #DFWTraffic;"1067008367170912257";https://twitter.com/TotalTrafficDFW/status/1067008367170912257
kisosuiende;2018-11-26 04:45;0;0;"Conseiller en dommages corporels, 24 heures sur 24, avocat, consultation, service, avocats, greycliff, mt 59033, cirugia de hernia de disco lumbar l5 s1: Les accidents de véhicules dans le montana sont une réalité de la vie. À l’échelle nationale, plus… http:// dlvr.it/Qs7489";;;;"1067006435299536896";https://twitter.com/kisosuiende/status/1067006435299536896
dfrtraffic;2018-11-26 04:28;0;0;"Motor Vehicle Accident | 36400 L B J FWY WB | https:// goo.gl/5D5dPT | EN54 | 250286 | 04:28 | B";;;;"1067002031259283457";https://twitter.com/dfrtraffic/status/1067002031259283457
dfrtraffic;2018-11-26 04:28;0;0;"Motor Vehicle Accident | L B J ACRD WB / S R L THORNTON FWY SB | https:// goo.gl/vU2NJx | EN46 | 460268 | 04:28 | B";;;;"1067002027287277573";https://twitter.com/dfrtraffic/status/1067002027287277573
dfrtraffic;2018-11-26 03:58;0;0;"Motor Vehicle Accident | 3700 S R L THORNTON FWY SB | https:// goo.gl/u6Ad4F | EN33 | 460346 | 03:58 | B";;;;"1066994475753336833";https://twitter.com/dfrtraffic/status/1066994475753336833
TotalTrafficDFW;2018-11-26 00:24;0;1;"Accident . two right lanes blocked in #Dallas on 75 SB at 635 Lbj Frwy #DFWTraffic http:// bit.ly/14TuwzZ";;;#Dallas #DFWTraffic;"1066940740398395392";https://twitter.com/TotalTrafficDFW/status/1066940740398395392
summer_galvez;2018-11-26 00:24;0;0;"Oh YOU WILL BE carrying that dog from your apartment/condo front door to the outside. Any attempts to let him walk will result in accidents on the way and now you’re THAT dog owner whose dog soils the premises. Now you gotta clean up puppy pee. It’s a lot.";;;;"1066940641798774784";https://twitter.com/summer_galvez/status/1066940641798774784
dpdcentral;2018-11-26 00:24;0;0;"Central Division responding to '07 - Minor Accident ' at Gaston Ave / N Good Latimer Expy | Beat 153 | https:// goo.gl/aAALFH | 00:21";;;;"1066940629307912192";https://twitter.com/dpdcentral/status/1066940629307912192
kisosuiende;2018-11-25 23:51;0;0;"Journée mondiale des accidents vasculaires cérébraux 2018 cœur des causes causales cérébrales d’anoxie dorée: Je suis né avec un anormal cœur soupape. On nous a dit il y a quelques années que j’aurais besoin d’un remplaçant. Deux semaines avant ma… http:// dlvr.it/Qs6FLz";;;;"1066932320899293184";https://twitter.com/kisosuiende/status/1066932320899293184
dfrtraffic;2018-11-25 23:48;0;0;"Motor Vehicle Accident | N CENTRAL SERV SB / L B J FWY WB | https:// goo.gl/dYf0zp | EN22 | 220045 | 23:48 | B";;;;"1066931559486242816";https://twitter.com/dfrtraffic/status/1066931559486242816
dfwrockchick;2018-11-25 23:24;0;0;"@lyft I need a report a Lyft driver for driving recklessly and almost causing an accident but all I have is his license plate number. I don’t want to post it publicly so will someone please DM ASAP.";;@lyft;;"1066925750736035840";https://twitter.com/dfwrockchick/status/1066925750736035840
HPxmusic;2018-11-25 22:11;0;1;"You = human (including myself) It's how God talks to me.. so I say "you" a lot on accident without realizing how people perceive it";;;;"1066907364278894594";https://twitter.com/HPxmusic/status/1066907364278894594
HisNameIsJuly;2018-11-25 22:09;0;0;"“Suck dick on accident ” bahanahhahaha pic.twitter.com/44djGpb9u1";;;;"1066906835289088001";https://twitter.com/HisNameIsJuly/status/1066906835289088001
dfrtraffic;2018-11-25 22:08;0;0;"Motor Vehicle Accident | 9800 Ferguson Rd | https:// goo.gl/JbjyfD | EN53 | 530159 | 22:08 | B";;;;"1066906394299789312";https://twitter.com/dfrtraffic/status/1066906394299789312
dfrtraffic;2018-11-25 21:58;0;0;"Motor Vehicle Accident | Spring Valley Rd / S Coit Rd | https:// goo.gl/JVKx3K | BC04 | 560015 | 21:58 | B";;;;"1066903878321397760";https://twitter.com/dfrtraffic/status/1066903878321397760
SouthwestAir;2018-11-25 21:51;0;0;"Understood. It's likely that Matthew's boarding pass came out of his bag and was put into yours by accident . That said, we appreciate you making us aware! -Nicole";;;;"1066902302852706304";https://twitter.com/SouthwestAir/status/1066902302852706304
MelissaEWright1;2018-11-25 21:41;0;0;"Thank you @StateFarm -Y'all are kindly giving the sports agent in your commercials a shove. Patrick is a lil tougher but I'd still like to see the sports agent get hit by a -An accident of course";;@StateFarm;;"1066899801005060099";https://twitter.com/MelissaEWright1/status/1066899801005060099
mdhirst95;2018-11-25 20:56;0;1;"one, tragic event, accident , etc. I’ve started to just say one. It’s not a me thing to make me feel better and as if I’m somehow helping out. It’s just this feeling I can’t kick about how somewhere, somehow, and in some capacity, this Earth carries a certain spirituality and...";;;;"1066888391395090432";https://twitter.com/mdhirst95/status/1066888391395090432
dfrtraffic;2018-11-25 20:28;0;1;"Motor Vehicle Accident | 6700 S R L Thornton Fwy Sb | https:// goo.gl/71Z81t | EN46 | 460318 | 20:28 | B";;;;"1066881230266753024";https://twitter.com/dfrtraffic/status/1066881230266753024
boonbiggidy;2018-11-25 20:27;0;0;"This is annoying but thank God I was able to pull over and not get into an accident";;;;"1066881131776303107";https://twitter.com/boonbiggidy/status/1066881131776303107
TotalTrafficDFW;2018-11-25 20:26;0;0;"Accident , right lane blocked in #Dallas on 35E SB at Kiest Blvd, stop and go traffic back to Illinois Ave, delay of 3 mins #DFWTraffic";;;#Dallas #DFWTraffic;"1066880916696510464";https://twitter.com/TotalTrafficDFW/status/1066880916696510464
dfrtraffic;2018-11-25 20:18;0;0;"Motor Vehicle Accident | HIGHLAND RD / FERGUSON RD | https:// goo.gl/vBa8ZX | EN53 | 530066 | 20:18 | B";;;;"1066878716326797312";https://twitter.com/dfrtraffic/status/1066878716326797312
dfrtraffic;2018-11-25 20:18;0;0;"Motor Vehicle Accident | S R L THORNTON FWY SB / W KIEST BLVD | https:// goo.gl/mlI3Bu | EN33 | 460348 | 20:18 | B";;;;"1066878712564465665";https://twitter.com/dfrtraffic/status/1066878712564465665
TotalTrafficDFW;2018-11-25 20:11;0;0;"Accident . two right lanes blocked. in #Dallas on 30 WB at Cesar Chavez Blvd, stop and go traffic back to Munger Blvd, delay of 7 mins";;;#Dallas;"1066877136479363073";https://twitter.com/TotalTrafficDFW/status/1066877136479363073
dailylazyquest;2018-11-25 20:11;0;0;"ok i killed my old ones i dunno how but i got two sorcermons on accident whoops pic.twitter.com/Y8dt0WGK6G";;;;"1066877113893076992";https://twitter.com/dailylazyquest/status/1066877113893076992
dfrtraffic;2018-11-25 19:58;0;0;"Motor Vehicle Accident | E R L THORNTON FWY WB / S CESAR CHAVEZ RAMP NB | https:// goo.gl/ZFRLgU | EN04 | 040022 | 19:58 | B";;;;"1066873686102237184";https://twitter.com/dfrtraffic/status/1066873686102237184
dfrtraffic;2018-11-25 19:58;0;0;"Motor Vehicle Accident | N Pearl St / Cedar Springs Rd | https:// goo.gl/X2tTfg | EN03 | 180022 | 19:58 | B";;;;"1066873683472396288";https://twitter.com/dfrtraffic/status/1066873683472396288
dfrtraffic;2018-11-25 19:58;1;1;"Motor Vehicle Accident | EASTRIDGE DR / SKILLMAN ST | https:// goo.gl/NAlGEx | EN37 | 370044 | 19:58 | B";;;;"1066873678976081920";https://twitter.com/dfrtraffic/status/1066873678976081920
TotalTrafficDFW;2018-11-25 19:26;0;0;"Accident has only the left lane getting by. in #Dallas on 30 WB at Cesar Chavez Blvd, stop and go traffic back to Munger Blvd #DFWTraffic";;;#Dallas #DFWTraffic;"1066865794590613504";https://twitter.com/TotalTrafficDFW/status/1066865794590613504
TotalTrafficDFW;2018-11-25 19:25;0;1;"Accident . two right lanes blocked in #Dallas on 30 WB at Cesar Chavez Blvd, stop and go traffic back to Munger Blvd, delay of 7 mins";;;#Dallas;"1066865533163843584";https://twitter.com/TotalTrafficDFW/status/1066865533163843584
TotalTrafficDFW;2018-11-25 19:20;0;1;"Accident has only the left lane getting by. in #Dallas on Woodall Rodgers WB at Pearl St, stop and go traffic back to 75 Central Expwy";;;#Dallas;"1066864360042184706";https://twitter.com/TotalTrafficDFW/status/1066864360042184706
_aikym;2018-11-25 19:03;0;0;"Omg, that was an accident .. i was tryna get on the Internet. Sorry Syd";;;;"1066859895692120064";https://twitter.com/_aikym/status/1066859895692120064
TotalTrafficDFW;2018-11-25 18:50;0;0;"Accident . two right lanes blocked in #Dallas on Woodall Rodgers WB at Pearl St, stop and go traffic back to 75 Central Expwy #DFWTraffic";;;#Dallas #DFWTraffic;"1066856672113549312";https://twitter.com/TotalTrafficDFW/status/1066856672113549312
dfrtraffic;2018-11-25 18:38;0;1;"Motor Vehicle Accident | PEMBERTON HILL RD / GREAT TRINITY FOREST WAY | https:// goo.gl/vYjHoV | EN34 | 340015 | 18:38 | B";;;;"1066853552088215552";https://twitter.com/dfrtraffic/status/1066853552088215552
dfrtraffic;2018-11-25 18:38;0;0;"Motor Vehicle Accident | Woodall Rodgers Fwy Eb / N Stemmons Fwy Sb | https:// goo.gl/gzKO9D | EN01 | 180013 | 18:38 | B";;;;"1066853545746456576";https://twitter.com/dfrtraffic/status/1066853545746456576
J_Martinson;2018-11-25 18:35;0;0;"Accident waiting to happen";;;;"1066852933025828865";https://twitter.com/J_Martinson/status/1066852933025828865
TotalTrafficDFW;2018-11-25 18:31;0;0;"Accident . two right lanes blocked in #Dallas on 75 NB at Meadow Rd, stop and go traffic back to Lovers Ln, delay of 12 mins #DFWTraffic";;;#Dallas #DFWTraffic;"1066851853189693440";https://twitter.com/TotalTrafficDFW/status/1066851853189693440
dpdincidents;2018-11-25 18:30;0;0;"Northwest Supervisor responding to '7X - Major Accident ' at W Mockingbird Ln / Inwood Rd | Beat 523 | https:// goo.gl/tr6Zse | 18:06";;;;"1066851557075968000";https://twitter.com/dpdincidents/status/1066851557075968000
AlijaNation;2018-11-25 18:29;0;0;"An accident waiting to happen";;;;"1066851465854107650";https://twitter.com/AlijaNation/status/1066851465854107650
TotalTrafficDFW;2018-11-25 18:18;0;0;"Accident reported in #Dallas on 75 NB at Royal Ln, stop and go traffic back to NW Hwy, delay of 6 mins #DFWTraffic http:// bit.ly/14TuwzZ";;;#Dallas #DFWTraffic;"1066848710544502784";https://twitter.com/TotalTrafficDFW/status/1066848710544502784
dfrtraffic;2018-11-25 18:18;0;0;"Motor Vehicle Accident | MAPLE AVE / DENTON DR CUT OFF | https:// goo.gl/J7WoyM | EN11 | 420004 | 18:18 | B";;;;"1066848524518612992";https://twitter.com/dfrtraffic/status/1066848524518612992
dfrtraffic;2018-11-25 18:18;0;0;"Motor Vehicle Accident | TRACY RD / SIMPSON STUART RD | https:// goo.gl/NS7VGS | EN54 | 540475 | 18:18 | B";;;;"1066848519942598656";https://twitter.com/dfrtraffic/status/1066848519942598656
dfrtraffic;2018-11-25 18:18;0;0;"Motor Vehicle Accident | N CENTRAL EXPY SB / ROYAL LN | https:// goo.gl/zcakmm | EN22 | 370090 | 18:18 | B";;;;"1066848514267799553";https://twitter.com/dfrtraffic/status/1066848514267799553
TheBigYogurt;2018-11-25 17:59;0;0;"You probably don't improve 3 because there's a 1/3rd chance that the accident happens in the middle of the road, which is very disruptive. And then, even if it happens on the sides, people slow to look at the accident , and emergency vehicles will block other lanes.";;;;"1066843826025885697";https://twitter.com/TheBigYogurt/status/1066843826025885697
TheBigYogurt;2018-11-25 17:56;0;0;"In practice, cars can only go as fast as the slowest car on the highway (1). Merging causes slowdowns (2). And accidents stop traffic all together (3). When you add a second lane, you solve 1, you mitigate 2, and you sort of improve 3 (an accident increases merging which slows).";;;;"1066843042219548672";https://twitter.com/TheBigYogurt/status/1066843042219548672
Hipichick1951;2018-11-25 17:53;0;1;"Just checked and it is still tied to our drivers license here. This is so important for everyone to do! I had a friend who wouldn’t do it because he thought if he had an accident in a small town and the mayor needed a transplant, they’d make sure he didn’t survive...";;;;"1066842296811966464";https://twitter.com/Hipichick1951/status/1066842296811966464
TotalTrafficDFW;2018-11-25 17:43;0;0;"Accident . two left lanes blocked in #SeDallas on 20 WB at Bonnie View Rd, stop and go traffic back to Hwy 310, delay of 5 mins #DFWTraffic";;;#SeDallas #DFWTraffic;"1066839782318329860";https://twitter.com/TotalTrafficDFW/status/1066839782318329860
TotalTrafficDFW;2018-11-25 17:42;0;0;"Accident , left lane blocked in #SeDallas on 20 WB at Bonnie View Rd, stop and go traffic back to Hwy 310, delay of 5 mins #DFWTraffic";;;#SeDallas #DFWTraffic;"1066839519020949504";https://twitter.com/TotalTrafficDFW/status/1066839519020949504
DR3WMARI3;2018-11-25 17:34;3;36;"u guys might think this is an exaggeration but it isn’t. FOUR minutes after we bought cricket we got in a car accident LMAOO https:// twitter.com/khaki_bus/stat us/1066833799663796225 …";;;;"1066837645626609664";https://twitter.com/DR3WMARI3/status/1066837645626609664
TotalTrafficDFW;2018-11-25 17:32;0;0;"Accident , left lane blocked in #SeDallas on 20 WB at Bonnie View Rd, stop and go traffic back to 45, delay of 4 mins #DFWTraffic";;;#SeDallas #DFWTraffic;"1066837140649185280";https://twitter.com/TotalTrafficDFW/status/1066837140649185280
dfrtraffic;2018-11-25 17:28;0;0;"Motor Vehicle Accident | L B J FWY EB / S LANCASTER RD | https:// goo.gl/J1RVL0 | EN46 | 460274 | 17:28 | B";;;;"1066835931154403328";https://twitter.com/dfrtraffic/status/1066835931154403328
dpdincidents;2018-11-25 17:10;0;0;"Northeast Supervisor responding to '7X - Major Accident ' at Ferguson Rd / Shiloh Rd | Beat 226 | https:// goo.gl/faITYt | 16:55";;;;"1066831401465466880";https://twitter.com/dpdincidents/status/1066831401465466880
Rickbee72;2018-11-25 17:03;0;0;"@MKBHD any plans to do a DashCam review video after the Accident ? pic.twitter.com/6AXFMdiZQz";;@MKBHD;;"1066829723047735296";https://twitter.com/Rickbee72/status/1066829723047735296
kristinadbrewer;2018-11-25 16:52;0;2;"I WANT TO DIE. I TRIED TO TAG @Malaamusic IN A VIDEO FROM MY TUMBLR APP BUT I TAGGED MALALA YOUSAFZAI ON ACCIDENT OH MY GOD.";;@Malaamusic;;"1066827102660567040";https://twitter.com/kristinadbrewer/status/1066827102660567040
dfrtraffic;2018-11-25 16:48;1;0;"Motor Vehicle Accident | Ferguson Rd / Shiloh Rd | https:// goo.gl/eVnV69 | EN39 | 390778 | 16:48 | B";;;;"1066825868368986112";https://twitter.com/dfrtraffic/status/1066825868368986112
dpdcentral;2018-11-25 16:32;0;0;"Central Division responding to '07 - Minor Accident ' at N Central Expy Sb / N Haskell Ave | Beat 143 | https:// goo.gl/ilU174 | 16:28";;;;"1066821838217469952";https://twitter.com/dpdcentral/status/1066821838217469952
Jaketheist;2018-11-25 16:24;0;0;"On weekend in college we threw two parties on accident . MFs just started showing up so we were like well I guess we better get bottles. Now I fall asleep at 8:30 every night watching my daughter's new favorite show: Octonauts. https://www. facebook.com/1724873919/pos ts/10204968199641107/ …";;;;"1066819883529326592";https://twitter.com/Jaketheist/status/1066819883529326592
dfrtraffic;2018-11-25 16:18;0;0;"Motor Vehicle Accident | 3300 MARYLAND AVE | https:// goo.gl/dgM2aT | EN23 | 330018 | 16:18 | B";;;;"1066818312510685185";https://twitter.com/dfrtraffic/status/1066818312510685185
dfrtraffic;2018-11-25 16:08;0;0;"Motor Vehicle Accident | 3200 Palo Alto Dr | https:// goo.gl/os09ku | EN54 | 540438 | 16:08 | B";;;;"1066815797576650753";https://twitter.com/dfrtraffic/status/1066815797576650753
Dallasinformer;2018-11-25 16:00;0;0;"Authorities Respond To ‘Street Racing’ Accident In Denton County https:// dallasinformer.com/327714/authori ties-respond-to-street-racing-accident-in-denton-county/ … pic.twitter.com/K4Rzfi4LXo";;;;"1066814002112671744";https://twitter.com/Dallasinformer/status/1066814002112671744
dfrtraffic;2018-11-25 15:48;0;0;"Motor Vehicle Accident | PINE ST / S CENTRAL SERV NB | https:// goo.gl/rQ44BX | EN24 | 240047 | 15:48 | B";;;;"1066810769394679809";https://twitter.com/dfrtraffic/status/1066810769394679809
dfrtraffic;2018-11-25 15:48;0;0;"Motor Vehicle Accident | 6400 LAKE JUNE RD | https:// goo.gl/ew2IMc | EN34 | 340087 | 15:48 | B";;;;"1066810766253146112";https://twitter.com/dfrtraffic/status/1066810766253146112
FeedDallas;2018-11-25 15:41;0;0;"CBS Dallas: Authorities Respond To ‘Street Racing’ Accident In Denton County https:// ift.tt/2DFINaJ #dallas";;;#dallas;"1066809083737575425";https://twitter.com/FeedDallas/status/1066809083737575425
amomynous3;2018-11-25 15:39;0;3;"I just want to vent to someone about all the shit I have to deal with. I should’ve died back in 2016 in my car accident . I never wear my seatbelt and that fucking day I was";;;;"1066808552461910016";https://twitter.com/amomynous3/status/1066808552461910016
dfrtraffic;2018-11-25 15:28;0;0;"Motor Vehicle Accident | 1600 W CAMP WISDOM RD | https:// goo.gl/YMkihq | EN46 | 400415 | 15:28 | B";;;;"1066805730487881728";https://twitter.com/dfrtraffic/status/1066805730487881728
dfrtraffic;2018-11-25 15:18;0;0;"Motor Vehicle Accident | E ILLINOIS AVE / LAMONT AVE | https:// goo.gl/jDvpuE | EN23 | 230014 | 15:18 | B";;;;"1066803220159225856";https://twitter.com/dfrtraffic/status/1066803220159225856
dfrtraffic;2018-11-25 15:18;0;0;"Motor Vehicle Accident | I 45 RAMP SB / E R L THORNTON RAMP WB | https:// goo.gl/3726fw | EN04 | 040025 | 15:18 | B";;;;"1066803213251239936";https://twitter.com/dfrtraffic/status/1066803213251239936
stephthweatt;2018-11-25 15:16;0;0;"@pewdiepie 11 hours and 48 minutes @MrBeastYT spoke nothing but your name...and Logan Paul’s twice on accident .. He’s committed.";;@pewdiepie @MrBeastYT;;"1066802905485856768";https://twitter.com/stephthweatt/status/1066802905485856768
_Henslayyy;2018-11-25 15:11;0;0;"I think I spoiled tink on accident";;;;"1066801685971038208";https://twitter.com/_Henslayyy/status/1066801685971038208
tonylethetiger;2018-11-25 15:05;0;3;"Everyone and they mama decided to get into an accident on 35 today";;;;"1066800054990721025";https://twitter.com/tonylethetiger/status/1066800054990721025
dpdcentral;2018-11-25 14:30;0;0;"Central Division responding to '7XF - Major Accident Freeway' at N Central Expy Sb / N Hall St | Beat 132 | https:// goo.gl/pPIBvj | 14:26";;;;"1066791138688790528";https://twitter.com/dpdcentral/status/1066791138688790528
TotalTrafficDFW;2018-11-25 14:22;0;0;"Accident . two right lanes blocked in #Dallas on 75 SB at Hall St, stop and go traffic back to Fitzhugh, delay of 2 mins #DFWTraffic";;;#Dallas #DFWTraffic;"1066789216724627456";https://twitter.com/TotalTrafficDFW/status/1066789216724627456
TotalTrafficDFW;2018-11-25 14:21;0;0;"Accident in #Dallas on 75 SB at Hall St, stop and go traffic back to Fitzhugh, delay of 2 mins #DFWTraffic http:// bit.ly/14TuwzZ";;;#Dallas #DFWTraffic;"1066789080158081025";https://twitter.com/TotalTrafficDFW/status/1066789080158081025
TotalTrafficDFW;2018-11-25 14:18;0;0;"Accident . two right lanes blocked in #Dallas on 35E SB at Continental Ave, stop and go traffic back to Market Ctr Blvd, delay of 5 mins";;;#Dallas;"1066788290160926721";https://twitter.com/TotalTrafficDFW/status/1066788290160926721
dfrtraffic;2018-11-25 14:18;0;0;"Motor Vehicle Accident | N CENTRAL EXPY SB / N HALL ST | https:// goo.gl/iBzA42 | EN11 | 180031 | 14:18 | B";;;;"1066788115774300161";https://twitter.com/dfrtraffic/status/1066788115774300161
gusjr_garcia;2018-11-25 14:12;0;0;"A triple headed inorganic alien that was once just an ordinary puppet used to entertain in galactic television; but before it could debut, a massive accident caused a tragic blow to the… https://www. instagram.com/p/BqncV34nIb1/ ?utm_source=ig_twitter_share&igshid=fai72ssc8pws …";;;;"1066786833860837378";https://twitter.com/gusjr_garcia/status/1066786833860837378
dfrtraffic;2018-11-25 14:08;0;0;"Motor Vehicle Accident | 200 N STEMMONS FWY NB | https:// goo.gl/lP877s | EN04 | 180008 | 14:08 | B";;;;"1066785603054751745";https://twitter.com/dfrtraffic/status/1066785603054751745
buhloud;2018-11-25 13:47;0;2;"I swear I be wanting to get dominated but let a nigga talk slick to me, i get slick back on accident :/";;;;"1066780452739006464";https://twitter.com/buhloud/status/1066780452739006464
dfrtraffic;2018-11-25 13:18;0;0;"Motor Vehicle Accident | 2000 S R L THORNTON FWY SB | https:// goo.gl/hSuHB4 | EN14 | 330057 | 13:18 | B";;;;"1066773019777855488";https://twitter.com/dfrtraffic/status/1066773019777855488
dfrtraffic;2018-11-25 13:18;0;0;"Motor Vehicle Accident | Skillman St / Walnut Hill Ln | https:// goo.gl/MEseK3 | EN57 | 570010 | 13:18 | B";;;;"1066773016556724224";https://twitter.com/dfrtraffic/status/1066773016556724224
ayrion16;2018-11-25 13:02;0;5;"Last year i dated this girl and burned a CD for her with songs she would sing to me and i was gonna give it to her for Christmas but i broke it on accident on thanksgiving";;;;"1066769186943315969";https://twitter.com/ayrion16/status/1066769186943315969
dfrtraffic;2018-11-25 12:58;0;0;"Motor Vehicle Accident | WINTERS ST / S MARSALIS AVE | https:// goo.gl/vNGBpL | EN15 | 150003 | 12:58 | B";;;;"1066767983635124224";https://twitter.com/dfrtraffic/status/1066767983635124224
TotalTrafficDFW;2018-11-25 12:52;0;0;"Closed due to accident in #Irving on Lp 12 Walton Walker SB between Irving Blvd and Shady Grove Rd #DFWTraffic http:// bit.ly/14TuwzZ";;;#Irving #DFWTraffic;"1066766600706101249";https://twitter.com/TotalTrafficDFW/status/1066766600706101249
pennie_reese;2018-11-25 12:50;0;0;"The Latest: Snow-related accidents close I-80 in Nebraska https://www. yahoo.com/news/latest-ne arly-500-flights-canceled-due-winter-storm-161730014.html?soc_src=hl-viewer&soc_trk=tw … via @YahooNews";;@YahooNews;;"1066766198161977344";https://twitter.com/pennie_reese/status/1066766198161977344
dfrtraffic;2018-11-25 12:28;0;0;"Motor Vehicle Accident | N WALTON WALKER BLVD SB / DALLAS FT WORTH TPKE WB | https:// goo.gl/rZgHsN | EN16 | 160035 | 12:28 | B";;;;"1066760433980211200";https://twitter.com/dfrtraffic/status/1066760433980211200
dfrtraffic;2018-11-25 12:28;0;0;"Motor Vehicle Accident | WILLOW LN / PRESTON RD | https:// goo.gl/BCnImG | EN20 | 200008 | 12:28 | B";;;;"1066760430989668352";https://twitter.com/dfrtraffic/status/1066760430989668352
TotalTrafficDFW;2018-11-25 12:26;0;0;"Accident blocking two right lanes in #Irving on Lp 12 SB near Singleton Blvd #DFWTraffic http:// bit.ly/14TuwzZ";;;#Irving #DFWTraffic;"1066760155965128705";https://twitter.com/TotalTrafficDFW/status/1066760155965128705
TotalTrafficDFW;2018-11-25 12:17;0;0;"Accident blocks right lane of ramp to eb woodall rogers in #Dallas on 35E SB at Woodall Rogers Frwy #DFWTraffic http:// bit.ly/14TuwzZ";;;#Dallas #DFWTraffic;"1066757793062023170";https://twitter.com/TotalTrafficDFW/status/1066757793062023170
dfrtraffic;2018-11-25 12:08;0;0;"Motor Vehicle Accident | N STEMMONS RAMP NB / WOODALL RODGERS FWY WB | https:// goo.gl/Egf0SS | EN04 | 180013 | 12:08 | B";;;;"1066755400618233856";https://twitter.com/dfrtraffic/status/1066755400618233856
MaxVonWhyDow;2018-11-25 11:56;0;3;"More like Texas' worst nightmare. Unregulated refineries where employees work garbage wages until there's an inevitable accident . https:// twitter.com/GregAbbott_TX/ status/1066749081375174656 …";;;;"1066752596843601920";https://twitter.com/MaxVonWhyDow/status/1066752596843601920
dfrtraffic;2018-11-25 11:38;0;0;"Motor Vehicle Accident | N COCKRELL HILL RD / DALLAS FT WORTH SERV WB | https:// goo.gl/0LmjCv | EN16 | 500430 | 11:38 | B";;;;"1066747851781238784";https://twitter.com/dfrtraffic/status/1066747851781238784
dfrtraffic;2018-11-25 11:18;0;0;"Motor Vehicle Accident | HARRY HINES BLVD / W NORTHWEST HWY | https:// goo.gl/mGk5QA | EN43 | 430034 | 11:18 | B";;;;"1066742818545094656";https://twitter.com/dfrtraffic/status/1066742818545094656
dfrtraffic;2018-11-25 11:08;0;0;"Motor Vehicle Accident | MARVIN D LOVE SERV NB / CLIFF CREEK CROSSING DR | https:// goo.gl/yKdpvX | EN54 | 400379 | 11:08 | B";;;;"1066740298590515200";https://twitter.com/dfrtraffic/status/1066740298590515200
TotalTrafficDFW;2018-11-25 10:56;2;1;"Accident , right lane blocked in #Dallas on 35E SB before S Beckley Ave, stop and go traffic back to Hwy 67, delay of 2 mins #DFWTraffic";;;#Dallas #DFWTraffic;"1066737493767319552";https://twitter.com/TotalTrafficDFW/status/1066737493767319552
israelstag;2018-11-25 10:56;0;0;""31 Dead in Ugandan Boat Accident , Toll Expected to Rise" by THE ASSOCIATED PRESS via NYT https://www. nytimes.com/aponline/2018/ 11/25/world/africa/ap-af-uganda-capsized-boat.html?partner=IFTTT …";;;;"1066737417493929985";https://twitter.com/israelstag/status/1066737417493929985
dfrtraffic;2018-11-25 10:38;0;0;"Motor Vehicle Accident | 7400 HUNNICUT RD | https:// goo.gl/QmpDkk | EN19 | 190028 | 10:38 | B";;;;"1066732749657038848";https://twitter.com/dfrtraffic/status/1066732749657038848
